{
  "schema_version": "1.0",
  "episode_key": "20260822_odyssey",
  "package_revision": 1,
  "production": {
    "run_key": "replace-with-production-run-key",
    "source_sha256": "0000000000000000000000000000000000000000000000000000000000000000",
    "source_basename": "2026-08-22 21-44-10.mov",
    "timeline_basis": "release-audio"
  },
  "provider": {"name": "transistor", "show_id": "12345", "episode_id": null},
  "show": {"title": "家庭时光胶囊播客", "language": "zh-CN"},
  "episode": {
    "title": "《示例》：一期关于英雄与归家的对谈",
    "author": "Example Host",
    "summary_file": "metadata/summary.txt",
    "summary_sha256": "0000000000000000000000000000000000000000000000000000000000000000",
    "description_file": "metadata/description.html",
    "description_sha256": "0000000000000000000000000000000000000000000000000000000000000000",
    "type": "full",
    "season": 1,
    "number": 1,
    "explicit": false,
    "participants": [
      {"name": "Example Host", "role": "host"},
      {"name": "Sage", "role": "guest"},
      {"name": "Felix", "role": "guest"}
    ],
    "alternate_url": null,
    "video_url": null,
    "keywords": null
  },
  "media": {
    "release_audio": "media/episode-release.mp3",
    "release_audio_sha256": "0000000000000000000000000000000000000000000000000000000000000000",
    "archive_master": "media/episode-master.wav",
    "archive_master_sha256": "0000000000000000000000000000000000000000000000000000000000000000",
    "target_lufs_i": -16.0,
    "max_true_peak_dbtp": -1.0
  },
  "transcript": {
    "text_file": "transcripts/transcript.txt",
    "text_sha256": "0000000000000000000000000000000000000000000000000000000000000000",
    "timed_file": "transcripts/transcript.vtt",
    "timed_sha256": "0000000000000000000000000000000000000000000000000000000000000000",
    "language": "zh-CN",
    "audio_sha256": "0000000000000000000000000000000000000000000000000000000000000000"
  },
  "chapters": {
    "file": "chapters/chapters.json",
    "sha256": "0000000000000000000000000000000000000000000000000000000000000000",
    "audio_sha256": "0000000000000000000000000000000000000000000000000000000000000000"
  },
  "artwork": {
    "episode_file": "artwork/episode-artwork.jpg",
    "episode_sha256": "0000000000000000000000000000000000000000000000000000000000000000",
    "public_image_url": null
  },
  "promo": {
    "launch_copy_file": "promo/launch-copy.md",
    "launch_copy_sha256": "0000000000000000000000000000000000000000000000000000000000000000",
    "share_url_placeholder": "{{share_url}}",
    "clip_manifest_file": null
  },
  "rights": {
    "content": {"status": "cleared", "reviewed_by": "Example Host", "reviewed_at": "2026-08-24T09:00:00+02:00"},
    "music": {"status": "not_applicable", "reviewed_by": "Example Host", "reviewed_at": "2026-08-24T09:00:00+02:00"},
    "artwork": {"status": "cleared", "reviewed_by": "Example Host", "reviewed_at": "2026-08-24T09:00:00+02:00"},
    "minor_consent": {"status": "cleared", "reviewed_by": "Example Host", "reviewed_at": "2026-08-24T09:00:00+02:00"}
  },
  "approvals": {
    "editorial": {"status": "approved", "approved_by": "Example Host", "approved_at": "2026-08-24T09:00:00+02:00", "artifact_sha256": "0000000000000000000000000000000000000000000000000000000000000000"},
    "transcript": {"status": "approved", "approved_by": "Example Host", "approved_at": "2026-08-24T09:00:00+02:00", "artifact_sha256": "0000000000000000000000000000000000000000000000000000000000000000"},
    "mastering": {"status": "approved", "approved_by": "Example Host", "approved_at": "2026-08-24T09:00:00+02:00", "artifact_sha256": "0000000000000000000000000000000000000000000000000000000000000000"},
    "artwork": {"status": "approved", "approved_by": "Example Host", "approved_at": "2026-08-24T09:00:00+02:00", "artifact_sha256": "0000000000000000000000000000000000000000000000000000000000000000"},
    "release_candidate": {"status": "approved", "approved_by": "Example Host", "approved_at": "2026-08-24T09:00:00+02:00", "payload_sha256": "0000000000000000000000000000000000000000000000000000000000000000", "release_audio_sha256": "0000000000000000000000000000000000000000000000000000000000000000"}
  },
  "preview": {"output_file": "preview/episode-release-preview.html"}
}
